"000A8E27-3DA7-4D49-961B-1C29A5447122";"Heeft de deelnemer op dit moment last van verwardheid of verminderd bewustzijn?"
"000B26CE-74B6-4016-92D9-8218B71213B1";"Heeft u momenteel betaald werk?"
"00112483-E9DB-4E00-8BE0-14356EDD2033";"Feeling down, depressed, or hopeless"
"001B7530-FE5C-4EEE-849C-9E028F3D2070";"Op welke datum heeft de deelnemer voor het laatst oorpijn ervaren?"
"00274AA7-DAD3-4491-9749-8A4E1F01C755";"Mijn gezondheid is uitstekend"
"002ABFB4-802D-44A8-81D5-448147527D15";"Is deze persoon overleden aan de gevolgen van COVID-19?"
"0039075C-5517-460A-A793-8C7115AAB726";"Heeft de deelnemer last (gehad) van huiduitslag sinds de start van de covid-klachten?"
"00488984-0ABD-42ED-9D0D-D9684D6B962F";"Nasal-pharyngeale swab"
"00924BA6-5763-4051-9CAF-9B39657AD10A";"Sinds het vorige bezoek en nu, welke mate van piepen tijdens de ademhaling heeft de deelnemer maximaal ervaren?"
"00954119-CD5E-49D0-9983-58F963D28053";"Keelpijn"
"00957376-9280-436B-BD86-B2DE09110F3B";"New or recurrent sore throat"
"00A11DFD-6659-4204-B9A8-22C5AEC677B1";"Loss of taste at baseline, no loss of taste now"
"00AD3518-14E1-427C-AF91-1C1AC0CBBA47";"Heeft de deelnemer opnieuw last van diarree gekregen na het vorige bezoek?"
"00C54FA8-1431-4E43-96B5-B4DB5D24B08F";"FiO2?"
"00CE2905-A089-4C50-BC6C-1E523FC36380";"Meningitis / encephalitis"
"00DA7A6D-C94F-4555-AEF3-45C9807DE9FB";"Uw partner en u gingen uit elkaar."
"00E40745-EA13-44ED-B866-B2BF30106C82";"Heeft u momenteel last van één van de volgende verschijnselen?"
"00EBDC83-B904-46FD-BF7C-5FB027F5239C";"Pre-Ventolin % van voorspeld"
"00F19778-D08F-4B9D-9DCB-0D0A10F211A7";"Hoeveel weken heeft u hulp bij de verzorging van uzelf gehad? (*Tel alle weken in de afgelopen 3 maanden bij elkaar op. Let op: een periode van 3 maanden telt 13 weken*)"
"00F56C7F-39A6-4089-BE9A-4034A8B7CD90";"Serum (STOL) afgenomen?"
"010F0BDF-18E7-4839-A2CA-851B666C88E4";"Namelijk:"
"011E8B9C-2DF7-4488-AE5F-1C202E150A5F";"FEV1 post-Ventolin"
"012C96BB-F376-452A-8894-A030CFC74CE3";"If your household consist of more than 6 persons please fill out the eldest"
"013963CB-10F4-4792-B9F6-29A6933DC00E";"Klik voor elk monster aan of het afgenomen is of niet"
"01423959-BD4A-4B64-9EDE-296174540C27";"Wat voor stollingstoornis / intravasculaire stolling"
"01442453-9A97-417D-966D-8ABBD5F311B1";"Bij welke soorten dokters bent u op afspraak bij de polikliniek van het ziekenhuisgeweest."
"0144BC2D-8A81-49C5-A607-C637B3F7438E";"Datum van beoordeling"
"014BA886-D9FA-47CA-9EB2-04524F3A3C39";"Musculoskeletal"
"015C55E6-F1FE-4F51-BB2E-CDDA6ACD0D78";"Namelijk:"
"015E74B7-1A30-4A0D-AA26-E28BD7D7E751";"Sinds het vorige bezoek en nu, welke mate van gewrichtspijn heeft de deelnemer maximaal ervaren?"
"016B1144-5FAB-47E6-8F59-E1D09069BE71";"I try to look at the situation from an objective perspective."
"018AA8F9-9FFB-4B76-B1D2-E4DC01B66EF6";"Heeft de deelnemer last (gehad) van pijn op de borst sinds de start van de covid-klachten?"
"01989035-6097-41C1-A26F-2EE8980E741E";"Gedaan te hebben waartoe u volgens uzelf in staat bent"
"0199E5C5-A49E-4622-A0BD-4DF486BD9FA0";"Regelmatig terugkerende, onaangename dromen over de stressvolle gebeurtenis?"
"01B8EE15-A13A-427A-946D-0466C3CE0649";"Sinds het vorige bezoek en nu, welke mate van reukverlies heeft de deelnemer maximaal ervaren?"
"01BE8C8F-825F-4BED-99D7-4806AE7C31BB";"I tend to overdo things and then rest up for a while"
"01BFCA3B-0785-4AD0-9129-A980175FC1F1";"New or recurrent loss of appetite"
"01C66012-6D91-4C51-84CB-71245BB168CD";"Op welke datum heet de deelnemer voor het laatst verminderde eetlust ervaren?"
"01CAC660-02BA-4B32-92D6-448F0A975D83";"De volgende vraag  gaat over hoe vaak u het huis uit bent geweest voor iedere bovenstaande rede. Als u het precieze aantal niet weet, probeer dan het aantal in te schatten. In de afgelopen 7 dagen (1 week), hoe vaak bent u uit huis gegaan:"
"01D2F019-9CCD-4857-86C0-16C092D5AE05";"Pre-Ventolin"
"01F81332-06DE-4AFD-A8B2-91AEDC3EEAB6";"Naam van de medicatie"
"0214C569-B6DB-48B6-9D25-9F3F49CC18EC";"Welke mate van diarree  heeft  de deelnemer maximaal ervaren?"
"023C4482-DC91-4EDB-A180-B0C71B9E7EC3";"Sinds het vorige bezoek en nu, welke mate van piepen tijdens de ademhaling heeft de deelnemer maximaal ervaren?"
"025F0C12-5F96-4861-99AA-151EA77312ED";"Heeft de deelnemer op dit moment last van een loopneus of een verstopte neus?"
"027F1EE8-102F-48B6-ABF5-03BEFCB37E84";"Temperatuur gemeten anders"
"0281D1CB-B1A9-4C0E-8FCF-F4B02C8D6CBB";"Op welke datum heeft de deelnemer voor het laatst spierpijn ervaren?"
"028ECEAF-3DC2-4E81-8396-9C46463AFD65";"Hoest(te) de deelnemer slijm (sputum) op?"
"02B9AEF9-2AA2-442F-8E6F-9597CE0A11E5";"Other:"
"02C32292-4EA8-4209-A929-4AC74C24CD27";"Specificeer de matig tot ernstige leverziekte"
"02C940D1-4DE1-47A9-B345-774C04569E83";"Op welke datum heeft de deelnemer voor het laatst verminderde eetlust ervaren?"
"02D87745-04B6-42DF-9FCD-B61B70F9B8B7";"Aantal dagen"
"02FC47B4-3272-4FBB-B889-D952019B3A5C";"Is antwoord consistent?"
"03013CA7-AB59-49C8-9B70-AF6A75F6FEEE";"Overige redenen"
"0315ACEF-17A4-4206-8CCF-4221D5549DAB";"Datum eerste positieve bloedkweek"
"031E61A1-8ED5-4313-8705-7A43EAC9827F";"Diabetes zonder complicaties"
"0321E986-4043-4B86-94C6-E2E26850E465";"Heeft de deelnemer op dit moment last van oorpijn?"
"032611B3-B6BA-48D7-A5A7-74C36EA89751";"How many appointments did you have with your GP *in the past 3 months*?"
"033086EE-B48D-427E-AFE6-C7EA308AA5FB";"In een supermarkt niet kunnen vinden wat u zoekt terwijl het er wel is"
"0359CAE1-810B-41C7-A5CE-9980E9F01DDF";"Currently employed"
"036906AE-A01F-44F5-A62A-CD860FDFFE44";"Ik zou lichamelijke inspanning moeten vermijden wanneer ik klachten  heb."
"0376EF29-11A4-4AF1-A65A-0E714C24D980";"Sterke, negatieve gevoelens ervaren zoals angst, afschuw, boosheid, schuld of schaamte?"
"03804944-3D73-444F-AC10-779775958E9D";"Waar is de COVID-19 diagnose voor het eerst gesteld?"
"039685CB-DB5D-4CB1-9899-F6B6B6259140";"FEV1 % van voorspeld pre-Ventolin"
"03A9374F-45F6-4A4B-8A12-9675B47BC4D4";"New or recurrent nausea or vomiting"
"03B35A1D-0E58-499C-AF8E-8E02E2AB106F";"Heeft de deelnemer last (gehad) van een loopneus of een verstopte neus sinds de start van de covid-klachten?"
"03BA15AF-9161-4E7B-8B00-335AF616F754";"Aantal dagen huiduitslag gehad"
"03C0FFA4-5891-45F8-86E6-981B0D26CBE6";"Heeft u tussen het vorige bezoek en nu last van één van de volgende verschijnselen gehad?"
"03CD79CC-19D3-4602-B3EA-4D13A3693131";"Per ongeluk tegen mensen opbotsen"
"03DC3F7A-E0FA-49A6-A46E-E4AB81144EB8";"Aantal dagen kortademigheid of benauwdheid ervaren"
"03DD1067-BEE4-417F-8320-CCECBEBCA5F8";"OUD VELD, NIET INVULLEN - GGD priv-ID: V"
"03EEDD50-76E0-4020-BC33-1F9981A6F23D";"In hoeverre ervaart u lichamelijke klachten van uw ziekte door het coronavirus?"
"03FF834F-DC6A-4594-A216-4769FBEF5667";"Wegwijzers over het hoofd zien"
"04015930-F972-4FDA-88C5-88D0CF997FC5";"Is er een nieuwe IC-opname geweest sinds het vorige uitgebreide bezoek?"
"0403C4E3-07F1-4551-8030-2070DD852096";"Datum CT thorax"
"0406516E-7F34-4F81-B63E-AF2EC7213851";"Stel dat iemand, bijvoorbeeld uw partner, familielid of een bekende, u op deze dagen had geholpen. En al het onbetaalde werk wat u niet kon doen, voor u had gedaan. Hoeveel uur was die persoon hier op deze dagen dan gemiddeld mee bezig geweest?"
"040BC634-4C49-4D8F-BBBA-8E604A96158F";"Op welke datum heeft de deelnemer voor het laatst de piepende ademhaling ervaren?"
"04224C2C-1148-4A50-8324-8481FBE8C808";"Stomach ache at baseline or new or recurrent stomach ache"
"042F8FA7-6AF4-430D-B0AA-FC375B18BF73";"TLCOc (corrected for Hb)"
"043BE7BF-ED3D-4F31-BA86-34928458B43C";"Nierfalen met dialyse / niervervangende therapie"
"0445FED9-92FD-4950-AB75-946DF29F2AB1";"Worrying too much about different things"
"044A532F-1CF4-4759-90C0-8CB78AD03553";"Gewrichtspijn"
"0450BB29-0AF1-489A-8796-C0254E3C416A";"Heeft de deelnemer last gekregen van oorpijn na het vorige bezoek?"
"046EEC20-36A9-49A1-9319-8BC649C1E987";"Diarrhoea"
"04829DFB-BC5F-47D2-B678-ADFA88BA2D78";"Stollingsstoornis / intravasculaire stolling"
"0486D6FE-1559-42FE-A6BA-AD52BA697F2C";"Loopneus of een verstopte neus"
"0486ED67-35A2-401B-A26C-4C856CBDC100";"Op welke datum is de buikpijn begonnen?"
"048BADC4-5F16-458B-86A5-49053186D548";"Diffusietest gedaan?"
"04947223-169F-499F-BC43-6842F1DC1388";"Nierfalen met dialyse / niervervangende therapie"
"04B0A492-F91B-49FB-8E11-4E8606C0E787";"Welke metingen moeten er op maand 6 herhaald worden?"
"04B9ABCE-EEF5-493B-89B5-D72826CC143F";"Ear pain"
"04C02A7A-1EF8-4CDC-9C01-A37E0001F492";"Op welke datum heeft de deelnemer voor het laatst het flauwvallen ervaren?"
"04C0B384-7D10-4D7D-AAA1-729F14AADF12";"Datum van COVID-19 diagnose"
"04C74DEC-139B-416F-AF13-009EF9E7495A";"Datum van screenen"
"04D2C699-5599-40B7-8600-4BB53AD229E9";"What is your last earned net income per month before you were diagnosed with COVID-19?"
"04D5CE4E-5010-4ABE-9F95-BBBA65C4306B";"Sinds het vorige bezoek en nu, welke mate van buikpijn heeft de deelnemer maximaal ervaren?"
"04EB2E0B-9CBD-4CB5-94FB-B8124C4E748E";"Sinds het begin van de pijn op de borst, welke mate van pijn heeft de deelnemer maximaal ervaren?"
"04FE0859-C469-4134-A750-6F8FF76271CA";"FEV1 post-Ventolin"
"050A5675-6CB7-441F-B115-BEAD97DE4C21";"Heeft de deelnemer op dit moment koorts?"
"0512D24F-BA08-426F-BFEF-2FEE925D8BB2";"Below is a list of problems that people sometimes have in response to a very stressful experience. Please read each problem carefully and then click the button to indicate how much you have been bothered by that problem as a result of your disease because of COVID-19."
"05139DB6-41FC-40B0-9746-05F5569B4164";"Specify the 1st type"
